irun(64): 15.20-s051: (c) Copyright 1995-2018 Cadence Design Systems, Inc.
TOOL:	irun(64)	15.20-s051: Started on Mar 22, 2019 at 02:51:22 IST
irun
	-access +rwc
	fetch_stage.v
DEFINE gpdk045		$ANALOG/45nm/gpdk045		
|
irun: *W,DLCPTH (/tools/cadence/FOUNDRY/cds.lib,15): cds.lib Permission denied '/tools/cadence/FOUNDRY/analog/45nm/gpdk045' (cds.lib command ignored).
DEFINE rfLib_new	/home/install/FOUNDRY/rfLib_new
|
irun: *W,DLCPTH (/tools/cadence/FOUNDRY/cds.lib,19): cds.lib Invalid path '/home/install/FOUNDRY/rfLib_new' (cds.lib command ignored).
DEFINE gpdk045		$ANALOG/45nm/gpdk045		
|
irun: *W,DLCPTH (/tools/cadence/FOUNDRY/cds.lib,15): cds.lib Permission denied '/tools/cadence/FOUNDRY/analog/45nm/gpdk045' (cds.lib command ignored).
DEFINE rfLib_new	/home/install/FOUNDRY/rfLib_new
|
irun: *W,DLCPTH (/tools/cadence/FOUNDRY/cds.lib,19): cds.lib Invalid path '/home/install/FOUNDRY/rfLib_new' (cds.lib command ignored).
DEFINE gpdk045		$ANALOG/45nm/gpdk045		
|
irun: *W,DLCPTH (/tools/cadence/FOUNDRY/cds.lib,15): cds.lib Permission denied '/tools/cadence/FOUNDRY/analog/45nm/gpdk045' (cds.lib command ignored).
DEFINE rfLib_new	/home/install/FOUNDRY/rfLib_new
|
irun: *W,DLCPTH (/tools/cadence/FOUNDRY/cds.lib,19): cds.lib Invalid path '/home/install/FOUNDRY/rfLib_new' (cds.lib command ignored).
DEFINE gpdk045		$ANALOG/45nm/gpdk045		
|
irun: *W,DLCPTH (/tools/cadence/FOUNDRY/cds.lib,15): cds.lib Permission denied '/tools/cadence/FOUNDRY/analog/45nm/gpdk045' (cds.lib command ignored).
DEFINE rfLib_new	/home/install/FOUNDRY/rfLib_new
|
irun: *W,DLCPTH (/tools/cadence/FOUNDRY/cds.lib,19): cds.lib Invalid path '/home/install/FOUNDRY/rfLib_new' (cds.lib command ignored).
DEFINE gpdk045		$ANALOG/45nm/gpdk045		
|
ncvlog: *W,DLCPTH (/tools/cadence/FOUNDRY/cds.lib,15): cds.lib Permission denied '/tools/cadence/FOUNDRY/analog/45nm/gpdk045' (cds.lib command ignored).
DEFINE rfLib_new	/home/install/FOUNDRY/rfLib_new
|
ncvlog: *W,DLCPTH (/tools/cadence/FOUNDRY/cds.lib,19): cds.lib Invalid path '/home/install/FOUNDRY/rfLib_new' (cds.lib command ignored).
file: fetch_stage.v
	module worklib.fetch_stage:v
		errors: 0, warnings: 0
	Total errors/warnings found outside modules and primitives:
		errors: 0, warnings: 2
DEFINE gpdk045		$ANALOG/45nm/gpdk045		
|
irun: *W,DLCPTH (/tools/cadence/FOUNDRY/cds.lib,15): cds.lib Permission denied '/tools/cadence/FOUNDRY/analog/45nm/gpdk045' (cds.lib command ignored).
DEFINE rfLib_new	/home/install/FOUNDRY/rfLib_new
|
irun: *W,DLCPTH (/tools/cadence/FOUNDRY/cds.lib,19): cds.lib Invalid path '/home/install/FOUNDRY/rfLib_new' (cds.lib command ignored).
DEFINE gpdk045		$ANALOG/45nm/gpdk045		
|
irun: *W,DLCPTH (/tools/cadence/FOUNDRY/cds.lib,15): cds.lib Permission denied '/tools/cadence/FOUNDRY/analog/45nm/gpdk045' (cds.lib command ignored).
DEFINE rfLib_new	/home/install/FOUNDRY/rfLib_new
|
irun: *W,DLCPTH (/tools/cadence/FOUNDRY/cds.lib,19): cds.lib Invalid path '/home/install/FOUNDRY/rfLib_new' (cds.lib command ignored).
DEFINE gpdk045		$ANALOG/45nm/gpdk045		
|
ncelab: *W,DLCPTH (/tools/cadence/FOUNDRY/cds.lib,15): cds.lib Permission denied '/tools/cadence/FOUNDRY/analog/45nm/gpdk045' (cds.lib command ignored).
DEFINE rfLib_new	/home/install/FOUNDRY/rfLib_new
|
ncelab: *W,DLCPTH (/tools/cadence/FOUNDRY/cds.lib,19): cds.lib Invalid path '/home/install/FOUNDRY/rfLib_new' (cds.lib command ignored).
		Caching library 'worklib' ....... Done
	Elaborating the design hierarchy:
		Caching library 'worklib' ....... Done
	Top level design units:
		fetch_stage
	Building instance overlay tables: .................... Done
	Generating native compiled code:
DEFINE gpdk045		$ANALOG/45nm/gpdk045		
|
ncvlog_cg: *W,DLCPTH (/tools/cadence/FOUNDRY/cds.lib,15): cds.lib Permission denied '/tools/cadence/FOUNDRY/analog/45nm/gpdk045' (cds.lib command ignored).
DEFINE rfLib_new	/home/install/FOUNDRY/rfLib_new
|
ncvlog_cg: *W,DLCPTH (/tools/cadence/FOUNDRY/cds.lib,19): cds.lib Invalid path '/home/install/FOUNDRY/rfLib_new' (cds.lib command ignored).
		worklib.fetch_stage:v <0x00facc13>
			streams:   3, words:   474
		worklib.instruction_mem:v <0x11890607>
			streams:   5, words:  1820
		worklib.pc:v <0x42d68b3e>
			streams:   2, words:   491
		worklib.pc_update:v <0x11b3a050>
			streams:   2, words:   436
	Building instance specific data structures.
	Loading native compiled code:     .................... Done
	Design hierarchy summary:
		             Instances  Unique
		Modules:             4       4
		Registers:           4       4
		Scalar wires:        8       -
		Vectored wires:      9       -
		Always blocks:       4       4
		Initial blocks:      1       1
		Cont. assignments:   1       2
		Pseudo assignments:  3       3
	Writing initial simulation snapshot: worklib.fetch_stage:v
DEFINE gpdk045		$ANALOG/45nm/gpdk045		
|
ncsim: *W,DLCPTH (/tools/cadence/FOUNDRY/cds.lib,15): cds.lib Permission denied '/tools/cadence/FOUNDRY/analog/45nm/gpdk045' (cds.lib command ignored).
DEFINE rfLib_new	/home/install/FOUNDRY/rfLib_new
|
ncsim: *W,DLCPTH (/tools/cadence/FOUNDRY/cds.lib,19): cds.lib Invalid path '/home/install/FOUNDRY/rfLib_new' (cds.lib command ignored).
Loading snapshot worklib.fetch_stage:v .................... Done
ncsim> source /tools/cadence/INCISIVE152/tools/inca/files/ncsimrc
ncsim> run
ncsim: *W,RMEMNOF: $readmem error: open failed on file "instructions.hex".
            File: ./instruction_mem.v, line = 19, pos = 40
           Scope: fetch_stage.instruction_mem_inst
            Time: 0 FS + 0

ncsim: *W,RNQUIE: Simulation is complete.
ncsim> exit
TOOL:	irun(64)	15.20-s051: Exiting on Mar 22, 2019 at 02:51:22 IST  (total: 00:00:00)
